{
  "schema_version": 1,
  "approval_state": "candidate",
  "commit": null,
  "source_tree": null,
  "tag": null,
  "go_module": "go.minekube.com/connect",
  "corpus_tree": null,
  "corpus_digest_sha256": "83d3cd045a62e09e331aecece0f7977b06ca5a577f4ff0345be10cd4736a7b07",
  "schema_sha256": "e8f81b8f22cdffed3ebf1c9cc5b2b3a8c43a0102d93f954d9ad2956fc36168a7",
  "metadata_schema_sha256": "eb92504aee4943144e7d25a5a7dc4fea63429cb848f5cbb6c14fc63254bd1589",
  "artifact_sha256": null
}
